<?xml version="1.0" encoding="UTF-8"?>
<!-- XMLEmulationScript.xsd can also be found on http://mobilis.inf.tu-dresden.de/XMLEmulationScript/XMLEmulationScript.xsd -->
<script xmlns="http://mobilis.inf.tu-dresden.de/XMLEmulationScript" xmlns:xsi="http://www.w3.org/2001/XMLSchema-instance" xsi:schemaLocation="http://mobilis.inf.tu-dresden.de/XMLEmulationScript http://mobilis.inf.tu-dresden.de/XMLEmulationScript.xsd">

	<!-- define application instances -->
	<instance varName="MisterX" appNS="de.tudresden.inf.rn.mobilis.android.xhunt" instanceId="1"/>
	<instanceGroup firstInstanceId="1" appNS="de.tudresden.inf.rn.mobilis.android.xhunt" instanceCount="3" varName="Agents"/>
	
	<!-- start command -->
	<start instance="MisterX" />
	<start instance="Agents" />
	
	<!-- wait -->
	<wait time="10000"/>

	<!-- first MisterX clicks play -->
	<appCommand instance="MisterX" methodName="clickOnButton">
		<parameter>
			<string>Play</string>
		</parameter>
	</appCommand>
	
	<!-- MisterX waits for OpenGamesActivity -->
	<appCommand instance="MisterX" methodName="waitForActivtiy">
		<parameter>
			<string>OpenGamesActivity</string>
		</parameter>
	</appCommand>
	
	<!-- MisterX - Create Game -->
	<appCommand instance="MisterX" methodName="clickOnButton">
		<parameter>
			<string>Create New Game</string>
		</parameter>
	</appCommand>
	<appCommand instance="MisterX" methodName="enterText">
		<parameter>
			<string>XHuntTestGame</string>
		</parameter>
	</appCommand>
	<appCommand instance="MisterX" methodName="clickOnButton">
		<parameter>
			<string>Ok</string>
		</parameter>
	</appCommand>
	<appCommand instance="MisterX" methodName="clickOnText">
		<parameter>
			<string>Dresden</string>
		</parameter>
	</appCommand>
	<appCommand instance="MisterX" methodName="clickOnButton">
		<parameter>
			<string>Create</string>
		</parameter>
	</appCommand>
	<appCommand instance="MisterX" methodName="waitForActivity">
		<parameter>
			<string>LobbyActivity</string>
		</parameter>
	</appCommand>
	<wait time="5000"/>
	
	<!-- next Agents click Play and join the game -->
	<appCommand instance="Agents" methodName="clickOnButton">
		<parameter>
			<string>Play</string>
		</parameter>
	</appCommand>
	<appCommand instance="Agents" methodName="waitForActivtiy">
		<parameter>
			<string>OpenGamesActivity</string>
		</parameter>
	</appCommand>
	<appCommand instance="Agents" methodName="clickOnText">
		<parameter>
			<string>XHuntTestGame</string>
		</parameter>
	</appCommand>
	<appCommand instance="Agents" methodName="clickOnText">
		<parameter>
			<string>Join</string>
		</parameter>
	</appCommand>
	<appCommand instance="Agents" methodName="waitForActivity">
		<parameter>
			<string>LobbyActivity</string>
		</parameter>
	</appCommand>
	
	<wait time="5000"/>
	
	<!-- Agents click Ready -->
	<appCommand instance="Agents" methodName="clickOnButton">
		<parameter>
			<string>Ready</string>
		</parameter>
	</appCommand>
	
	<wait time="5000"/>
	
	<!-- MisterX clicks Ready -->
	<appCommand instance="MisterX" methodName="clickOnButton">
		<parameter>
			<string>Ready</string>
		</parameter>
	</appCommand>
	
	<!-- both wait for XHuntMapActivtiy -->
	<appCommand instance="MisterX" methodName="waitForActivity">
		<parameter>
			<string>XHuntMapActivity</string>
		</parameter>
	</appCommand>
	<appCommand instance="Agents" methodName="waitForActivity">
		<parameter>
			<string>XHuntMapActivity</string>
		</parameter>
	</appCommand>
	<wait time="5000"/>
		
	<!-- play 3 rounds -->
	<for times="3">
		<!-- First: MisterX -->
		<appCommand instance="MisterX" methodName="waitForText">
			<parameter>
				<string>New Round</string>
			</parameter>
		</appCommand>
		<appCommand instance="MisterX" methodName="clickOnButton">
			<parameter>
				<string>OK</string>
			</parameter>
		</appCommand>
		<appCommand instance="MisterX" methodName="centerMap"/>
		<!-- setMapZoom is executed only in first round -> implemented on client-side -->
		<!-- int-param => actual zoom-level + #num -->
		<appCommand instance="MisterX" methodName="setMapZoom">
			<parameter>
				<int>1</int>
			</parameter>
		</appCommand>
		<!-- click on a station randomly -->
		<appCommand instance="MisterX" methodName="selectNextStation"/>
		<appCommand instance="MisterX" methodName="clickOnText">
			<parameter>
				<string>Select as next target</string>
			</parameter>
		</appCommand>
		
		<!-- Then the Agents -->
		<appCommand instance="Agents" methodName="waitForText">
			<parameter>
				<string>New Round</string>
			</parameter>
		</appCommand>
		<appCommand instance="Agents" methodName="clickOnButton">
			<parameter>
				<string>OK</string>
			</parameter>
		</appCommand>
		<appCommand instance="Agents" methodName="centerMap"/>
		<!-- setMapZoom is executed only in first round -> implemented on client-side -->
		<!-- int-param => actual zoom-level + #num -->
		<appCommand instance="Agents" methodName="setMapZoom">
			<parameter>
				<int>1</int>
			</parameter>
		</appCommand>
		<!-- click on a station randomly -->
		<appCommand instance="Agents" methodName="selectNextStation"/>
		<appCommand instance="Agents" methodName="clickOnText">
			<parameter>
				<string>Select as next target</string>
			</parameter>
		</appCommand>
	</for>
	
	<!-- now MisterX leaves the game -->
	<appCommand instance="MisterX" methodName="waitForText">
		<parameter>
			<string>New Round</string>
		</parameter>
	</appCommand>
	<appCommand instance="MisterX" methodName="clickOnButton">
		<parameter>
			<string>OK</string>
		</parameter>
	</appCommand>
	<appCommand instance="MisterX" methodName="clickOnMenuItem">
		<parameter>
			<string>Quit</string>
		</parameter>
	</appCommand>
	<appCommand instance="MisterX" methodName="clickOnButton">
		<parameter>
			<string>OK</string>
		</parameter>
	</appCommand>
	<appCommand instance="MisterX" methodName="waitForActivity">
		<parameter>
			<string>OpenGamesActivity</string>
		</parameter>
	</appCommand>
	
	<!-- Agents get GameOver-Message, leave game -->
	<appCommand instance="Agents" methodName="waitForText">
		<parameter>
			<string>Game Over</string>
		</parameter>
	</appCommand>
	<appCommand instance="Agents" methodName="clickOnButton">
		<parameter>
			<string>Ok</string>
		</parameter>
	</appCommand>
	
	<stop instance="MisterX"/>
	<stop instance="Agents"/>

</script>