<?xml version="1.0" encoding="UTF-8"?>
<!-- XMLEmulationScript.xsd can also be found on http://mobilis.inf.tu-dresden.de/XMLEmulationScript/XMLEmulationScript.xsd -->
<script xmlns="http://mobilis.inf.tu-dresden.de/XMLEmulationScript" xmlns:xsi="http://www.w3.org/2001/XMLSchema-instance" xsi:schemaLocation="http://mobilis.inf.tu-dresden.de/XMLEmulationScript http://mobilis.inf.tu-dresden.de/XMLEmulationScript.xsd">
	<!-- define application instances -->
	<instance varName="doctor" appNS="time.lord" instanceId="1"/>
	<instanceGroup varName="daleks" appNS="evil.race" firstInstanceId="1" instanceCount="20"/>
	<instanceGroup firstInstanceId="21" appNS="evil.race" instanceCount="3" varName="daleks2"/>
	
	<!-- start instances -->
	<start instance="daleks"/>
	<start instance="daleks2"/>
	<start instance="doctor"/>
	
	<!-- run commands -->
	<appCommand instance="daleks" methodName="exterminate"/>
	<for times="20">
		<appCommand instance="doctor" methodName="useScrewdriver"/>
	</for>
	
	<!-- wait 10 seconds -->
	<wait time="10000"/>
	
	<!-- run some more commands -->
	<appCommand instance="doctor" methodName="rescueWorld" async="true">
	    <parameter>
	        <string>tardis</string>
	        <boolean>true</boolean>
	        <int>42</int>
	    </parameter>
	</appCommand>
	<appCommand instance="daleks" methodName="roll">
	    <parameter>
	        <double>42.00</double>
	    </parameter>
	</appCommand>
	<appCommand instance="daleks2" methodName="shout">
		<parameter>
			<string>Exterminate!</string>
			<string>%id%</string>
		</parameter>
	</appCommand>
	
	<!-- stop instances -->
	<stop instance="daleks"/>
	<stop instance="daleks2"/>
	<stop instance="doctor"/>
</script>