<?xml version="1.0" encoding="UTF-8"?>
<!-- XMLEmulationScript.xsd can also be found on http://mobilis.inf.tu-dresden.de/XMLEmulationScript/XMLEmulationScript.xsd -->
<script xmlns="http://mobilis.inf.tu-dresden.de/XMLEmulationScript" xmlns:xsi="http://www.w3.org/2001/XMLSchema-instance" xsi:schemaLocation="http://mobilis.inf.tu-dresden.de/XMLEmulationScript http://mobilis.inf.tu-dresden.de/XMLEmulationScript.xsd">
	<!-- define application instances -->
	<instance varName="deviceMisterX" appNS="de.tudresden.inf.rn.mobilis.android.xhunt" instanceId="1"/>
	<instance varName="deviceAgent" appNS="de.tudresden.inf.rn.mobilis.android.xhunt" instanceId="2"/>
	
	<!-- start instances -->
	<start instance="deviceMisterX"/>
	<start instance="deviceAgent"/>
	
	<!-- run commands -->
	<appCommand instance="deviceMisterX" methodName="clickOnButton">
		<parameter>
			<string>Play</string>
		</parameter>
	</appCommand>
	<appCommand instance="deviceMisterX" methodName="clickOnButton">
		<parameter>
			<string>Create New Game</string>
		</parameter>
	</appCommand>
	<appCommand instance="deviceMisterX" methodName="enterText">
		<parameter>
			<string>EmulationTest</string>
		</parameter>
	</appCommand>
	<appCommand instance="deviceMisterX" methodName="clickOnButton">
		<parameter>
			<string>Ok</string>
		</parameter>
	</appCommand>
	<appCommand instance="deviceMisterX" methodName="clickOnText">
		<parameter>
			<string>Dresden</string>
		</parameter>
	</appCommand>
	<appCommand instance="deviceMisterX" methodName="clickOnButton">
		<parameter>
			<string>Create</string>
		</parameter>
	</appCommand>
	<!-- wait for MisterX to create the Game -->
	<wait time="15000"/>
	
	<!-- stop instances -->
	<!-- stop instance="daleks"/ -->
	<!-- stop instance="doctor"/ -->
</script>